{
  "part_id": 2,
  "slug": "signs-and-experiences",
  "title": "Signs and Experiences",
  "form": "F-PORTRAIT",
  "meta": {
    "thesis_claim": "The symptoms that define schizophrenia in the public mind, voices and delusions, are the ones that matter least for how a life actually goes; the negative and cognitive symptoms nobody pictures are what predict whether someone works, studies, and connects.",
    "the_risk": "Positive symptoms own the public image but are the weakest predictor of functional outcome; the negative and cognitive symptoms nobody pictures carry the weight.",
    "reviewer_credit": "Reviewed by Dr. Lena Dobson, Ph.D. in Clinical Neuropsychology.",
    "word_count": 1417,
    "claim_count": 11
  },
  "enrich": {
    "summary": null,
    "keyFacts": [
      {"text": "In the largest survey of voice-hearing, fewer than half of participants described experiences that were literally auditory, 46% reported thought-like or mixed voices instead.", "citationIndex": 2},
      {"text": "Overall cognitive performance in schizophrenia sits about one standard deviation below healthy peers, a grand mean effect size of g = -1.03.", "citationIndex": 5},
      {"text": "Positive symptoms, voices and delusions, were not significantly associated with functional outcome in a single study in a landmark review; cognition and negative symptoms carry that weight.", "citationIndex": 7},
      {"text": "Auditory hallucinations affect roughly 60-80% of people with a schizophrenia-spectrum diagnosis, but about 53% of those who hallucinate do so in more than one sense at once.", "citationIndex": 11},
      {"text": "Insight is variable, not absent: in one outpatient sample about half had at least moderately impaired insight and a quarter had severe deficits.", "citationIndex": 12}
    ],
    "sparkMoment": "The symptoms that put schizophrenia in every movie are the ones that matter least for how a life turns out.",
    "practicalExercise": null
  },
  "citations": [
    {"n": 1, "dossier_id": "P2-kean-silencing-self-fpa", "tier": "T5", "year": 2009, "pmid": "19478239", "doi": "10.1093/schbul/sbp043", "citation_text": "Kean C. Silencing the self: schizophrenia as a self-disturbance. Schizophrenia Bulletin. 2009."},
    {"n": 2, "dossier_id": "P2-woods-hearing-voices-phenomenology", "tier": "T2", "year": 2015, "pmid": "26360085", "doi": "10.1016/s2215-0366(15)00006-1", "citation_text": "Woods A, et al. Experiences of hearing voices: analysis of a novel phenomenological survey. The Lancet Psychiatry. 2015."},
    {"n": 3, "dossier_id": "P2-coltheart-delusion-second-factor", "tier": "T2", "year": 2021, "pmid": "33874847", "doi": "10.1080/13546805.2021.1914016", "citation_text": "Coltheart M, et al. Failure of hypothesis evaluation as a factor in delusional belief. Cognitive Neuropsychiatry. 2021."},
    {"n": 4, "dossier_id": "P2-marder-negative-symptom-domains", "tier": "T3", "year": 2017, "pmid": "28127915", "doi": "10.1002/wps.20385", "citation_text": "Marder SR, et al. The current conceptualization of negative symptoms in schizophrenia. World Psychiatry. 2017."},
    {"n": 5, "dossier_id": "P2-schaefer-global-cognitive-impairment", "tier": "T1", "year": 2013, "pmid": "23911259", "doi": "10.1016/j.schres.2013.07.009", "citation_text": "Schaefer J, et al. The global cognitive impairment in schizophrenia: consistent over decades and around the world. Schizophrenia Research. 2013."},
    {"n": 6, "dossier_id": "P2-dickinson-digit-symbol-coding", "tier": "T1", "year": 2007, "pmid": "17485605", "doi": "10.1001/archpsyc.64.5.532", "citation_text": "Dickinson D, et al. Overlooking the obvious: a meta-analytic comparison of digit symbol coding tasks and other cognitive measures in schizophrenia. Archives of General Psychiatry. 2007."},
    {"n": 7, "dossier_id": "P2-green-1996-functional-consequences", "tier": "T3", "year": 1996, "pmid": "8610818", "doi": "10.1176/ajp.153.3.321", "citation_text": "Green MF. What are the functional consequences of neurocognitive deficits in schizophrenia? The American Journal of Psychiatry. 1996."},
    {"n": 8, "dossier_id": "P2-rabinowitz-catie-neg-gt-pos", "tier": "T2", "year": 2012, "pmid": "22316568", "doi": "10.1016/j.schres.2012.01.015", "citation_text": "Rabinowitz J, et al. Negative symptoms have greater impact on functioning than positive symptoms in schizophrenia: analysis of CATIE data. Schizophrenia Research. 2012."},
    {"n": 9, "dossier_id": "P2-salazardepablo-chr-transition", "tier": "T1", "year": 2021, "pmid": "34259821", "doi": "10.1001/jamapsychiatry.2021.0830", "citation_text": "Salazar de Pablo G, et al. Probability of transition to psychosis in individuals at clinical high risk: an updated meta-analysis. JAMA Psychiatry. 2021."},
    {"n": 10, "dossier_id": "P2-olbert-polythetic-heterogeneity", "tier": "T2", "year": 2014, "pmid": "24886017", "doi": "10.1037/a0036068", "citation_text": "Olbert CM, et al. Quantifying heterogeneity attributable to polythetic diagnostic criteria: theoretical framework and empirical application. Journal of Abnormal Psychology. 2014."},
    {"n": 11, "dossier_id": "P2-lim-hallucination-modalities", "tier": "T2", "year": 2016, "pmid": "27349814", "doi": "10.1016/j.schres.2016.06.010", "citation_text": "Lim A, et al. Prevalence and classification of hallucinations in multiple sensory modalities in schizophrenia spectrum disorders. Schizophrenia Research. 2016."},
    {"n": 12, "dossier_id": "P2-dickerson-insight-prevalence", "tier": "T2", "year": 1997, "pmid": "9021849", "doi": "10.1176/ps.48.2.195", "citation_text": "Dickerson FB, et al. Lack of insight among outpatients with schizophrenia. Psychiatric Services. 1997."}
  ],
  "body": [
    {
      "type": "QuoteBlock",
      "quote": "I was simply sectioned again, detached from my real self, observing what was being done to me in a third-person perspective. ... My thoughts, my emotions, and my actions, none of them belong to me any more.",
      "attribution": "Kean C, 2009",
      "source": "Kean C. Silencing the self: schizophrenia as a self-disturbance. Schizophrenia Bulletin. 2009. [1]"
    },
    {
      "type": "prose",
      "heading": "The symptoms you already know",
      "text": "Ask most people to describe schizophrenia and they name two things: hearing voices, and holding beliefs that are not true. These are the positive symptoms, 'positive' meaning added to experience, not good. From the outside they look like the whole condition. From the inside they are stranger, and more specific, than the cliche. A hallucination is a genuine perception, not an overactive imagination. The voice is heard the way a doorbell is heard; the brain delivers it with the full authority of the senses, which is exactly why it cannot be waved away. And it is not always a voice. In the largest phenomenological survey of voice-hearing, fewer than half of participants described experiences that were literally auditory, 46% reported thought-like or mixed voices instead [2]. A delusion, in turn, is not defined by being false. Plenty of false beliefs are ordinary. What marks a delusion is that it holds firm against evidence that should dismantle it, a failure, in two-factor accounts of delusional belief, to reject an idea in the face of disconfirmation [3]."
    },
    {
      "type": "prose",
      "heading": "The symptoms mistaken for character",
      "text": "If positive symptoms are additions, negative symptoms are subtractions, and they are the ones that get read as personality. A consensus of researchers groups them into distinct domains: blunted affect (a face and voice that stop showing feeling), alogia (speech that thins to almost nothing), anhedonia (pleasure gone flat), asociality (withdrawal from other people), and avolition (the collapse of drive and initiative) [4]. Named this way, they sound clinical. Lived from the outside, they look like flaws. The person who stops calling reads as cold. The person who cannot start a task reads as lazy. The person whose face has gone still reads as rude, or simply absent. None of these readings is what is actually happening, and every one of them is what the world sees."
    },
    {
      "type": "prose",
      "heading": "The symptoms nobody pictures",
      "text": "There is a third domain that almost never makes the picture at all: cognition. This is not about intelligence, and not about insight into any single belief. It is the machinery underneath, working memory (holding information in mind long enough to use it), processing speed (how fast the brain takes in and acts on information), and executive function (planning, switching tasks, keeping a goal in view). Across roughly a hundred studies, people with schizophrenia perform about a full standard deviation below healthy peers on cognitive testing overall, a grand mean effect size of g = -1.03 [5]. The single largest gap is in processing speed: on digit-symbol coding, a plain timed matching task, the deficit reaches g = -1.57, larger than the gaps in memory or executive function [6]. A standard deviation is not a rounding error. It is the distance between keeping up and falling behind, and it is completely invisible in a waiting room."
    },
    {
      "type": "ArticleTabs",
      "tabs": [
        {"label": "What it looks like", "content": "She said yes to dinner on Friday, then canceled an hour before, again. Last month she went quiet in the group chat and never came back. She seems checked out. Maybe rude. Maybe just not that invested in keeping you in her life. After a while you stop reaching out, because it starts to feel like you are the only one still trying."},